{
  "schemaVersion": 1,
  "id": "poimandres",
  "name": "Poimandres",
  "variant": "dark",
  "palette": {
    "background": "#1b1e28",
    "foreground": "#e4f0fb",
    "muted": "#8290a5",
    "black": "#171922",
    "gray": "#303340",
    "grayLight": "#41434F",
    "blueGrayDark": "#506477",
    "blueGray": "#7390aa",
    "blueGrayLight": "#91B4D5",
    "blue": "#add7ff",
    "cyan": "#89DDFF",
    "purple": "#767C9D",
    "purpleLight": "#a6accd",
    "pink": "#fcc5e9",
    "red": "#d0679d",
    "green": "#5fb3a1",
    "greenLight": "#5de4c7",
    "yellow": "#fffac2"
  },
  "tokens": {
    "background": "{palette.background}",
    "on_background": "{palette.foreground}",
    "surface": "{palette.background}",
    "on_surface": "{palette.foreground}",
    "on_surface_subdued": "{palette.muted}",
    "surface_variant": "{palette.gray}",
    "on_surface_variant": "{palette.purpleLight}",
    "surface_panel": "#f21b1e28",
    "surface_sidebar": "#171922",
    "surface_low": "#171922",
    "on_surface_panel": "{palette.foreground}",
    "surface_tooltip": "{palette.black}",
    "on_surface_tooltip": "{palette.muted}",
    "surface_hover": "{palette.grayLight}",
    "surface_pressed": "{palette.blueGrayDark}",
    "primary": "{palette.green}",
    "on_primary": "{palette.black}",
    "primary_container": "{palette.blueGray}",
    "on_primary_container": "{palette.black}",
    "secondary": "{palette.blueGray}",
    "on_secondary": "{palette.black}",
    "outline": "{palette.purple}",
    "outline_variant": "{palette.blueGrayDark}",
    "focus_ring": "{palette.cyan}",
    "on_surface_disabled": "{palette.blueGrayDark}",
    "on_surface_placeholder": "{palette.muted}",
    "link": "{palette.cyan}",
    "highlight": "{palette.yellow}",
    "on_highlight": "{palette.black}",
    "success": "{palette.greenLight}",
    "warning": "{palette.yellow}",
    "error": "{palette.red}",
    "shadow": "#80000000",
    "scrim": "#99000000",
    "charging": "{palette.yellow}"
  }
}
